name,munsell,description,rgb,systemcolorname
桧皮色（ひわだいろ）,1YR 4.3/4,桧(ひのき)の樹皮のような茶色の色名。ヒノキの樹皮を染料にしたわけではなく、黒みのある蘇芳の染色の色名といわれている。平安時代以来の伝統的な色名。,#8A604F,くらい灰みの黄赤
朽葉色（くちばいろ）,10YR 5/2,朽ちた落ち葉のような色。この色を中心に、赤みがあれば赤朽葉、黄みは黄朽葉、緑みがあれば青朽葉と呼び分けた。ほかにも朽葉のつく色名がいくつかある。伝統的な色名の中でも特に晩秋の季節感が濃厚な、平安中期からの色名。,#897868,灰みの赤みを帯びた黄
海松色（みるいろ）,9.5Y 4.5/2.5,海藻の一種であるミルは、「万葉集」に海松を詠みこんだ歌が出てくるほど、広く知られていたらしい。現在では一般的になじみがなくなってしまったが、中世以降はオリーブグリーンの色あいを表す、伝統的な色名の代表だった。,#736F55,暗い灰みの黄緑
栗色（くりいろ）,2YR 3.5/4,栗の実の表皮のような色のこと。 「栗皮色」という別名もあるが、これらは中世から近世にかけての呼び方。平安時代は「落栗(おちぐり)」 という名称で、秋の色目だった。,#754C38,暗い灰みの黄赤
ピーチ,3YR 8/3.5,日本語の桃色は花の色を表す色名。英語のビーチ、仏語のベッシュは、どちらも桃の果肉の色を表す色名で、桃色とは色がまるで違う。色名は16世紀の終わり頃から用いられるようになった。,#EBC0AF,明るい灰みの黄赤
ベージュ,10YR 7/2.5,ベージュは13世紀頃のフランス語で未加工、未漂白、未染色の毛織物の色の名前であった。その前はイタリア語でつめものの綿くずのことだったとも。それが19世紀には流行色の色名として、高級な色のシンボルとされるようになった。,#C1AB96,明るい灰みの赤みを帯びた黄
オリーブグリーン,2.5GY 3.5/3,オリープのつく色名は、イエロー、ブラウン、グリーン、グレイなどがあり、 その色域はかなり広いが、17世紀に初めて英語の色名になったのはオリーブグリーンであった。これが生の実の色なのか葉の色のことなのかはわかっていない。,#565838,暗い灰みの黄緑
ベビーブルー,10B 7.5/3,欧米で乳幼児服の標準色として用いられてきた色の色名。ベビーピンクよりも早くから使われていたが、それでも19世紀末のこと。青は聖母マリアの色で、その色を生まれた子どもに着せたいという願いを母親が抱いていたということである。,#ABBDDA,明るい灰みの青
ラベンダー,5P 6/3,19世紀後半にできた、ラベンダーの花のような色を表す色名。この花は水浴の際の香水に用いられたのでラテン語の洗うという意味のラバレ、青みのあることを表すリベレなどから名前がついたとのことである。,#9E8EAE,灰みの青みを帯びた紫