name,munsell,description,rgb,systemcolorname
甕覗き（かめのぞき）,4.5B 7/4,別名「のぞきいろ(覗き色)」。糸や布が藍がめをちょっとのぞいただけという意味。当然、ごく薄い藍染めの青になる。中世は薄い藍色を一入染(ひとしおそめ)といった。これは藍がめの中に1回布をくぐらせただけという染色であった。,#8CB4CE,やわらかい緑みの青
オールドローズ,1R 6/6.5,イギリスのビクトリア朝でもてはやされた流行色の色名。英語の色名にオールドという形容がつくと、古い、昔の、という連想から、くすんだ色、グレイッシュな色ということになる。つまりややくすんだ灰みのバラ色ということ。,#C97F96,やわらかい赤
アップルグリーン,10GY 8/5,日本でリンゴといえば赤だが、英語のアップルはグリーンの色名になっている。この色名が使われ始めた頃は、リンゴといえば縁だったのだろう。アダムとイヴが蛇の誘惑に負けて手にするリンゴも、絵画作品では青リンゴになっているものが多い。,#B0D3A8,やわらかい黄みの緑
ライラック,6P 7/6,ライラックの花の色からとられた薄紫の色名。英語の色名として定着したのは、1775年前後とされているが、この時代は紫や赤紫の化学染料がまだ発見されていない。単にライラックの花のような色という一般的な色名だったと考えられる。,#C2A2DA,やわらかい紫
紅梅色（こうばいいろ）,2.5R 6.5/7.5,紅梅の花のようなピンクの色名。 平安時代には冬から春にかけての色として愛好された。色が豊富な春の盛りには、紅梅色はややくどいと感じられたのか、清少納言は「すさまじき」色とし、見飽きのする色とも述べている。,#E08899,やわらかい赤
芥子色（からしいろ）,3Y 7/6,おでんなどでよく使われる練りからしの色で、ややくすんだ黄である。 練りからしは、カラシナの種子を粉にして練ったもの。英語ではマスタードやマスタードイエローと呼ばれるが、これらの色名はJIS規格にはない。,#CDA966,やわらかい黄
青磁色（せいじいろ）,7.5G 6.5/4,中国の唐の時代につくられた青磁は、平安時代に日本にも知られて 「秘色(ひそく)」と呼ばれていた。その青い磁器の肌のような色の染色の色名が後に青磁色と呼ばれるようになった。,#80AA9F,やわらかい青みの緑
サーモンピンク,8R 7.5/7.5,18世紀にできた色名。魚の切り身の色として最も特徴があるのはやはり鮭(さけ)の身の色である。ほかに魚の身の色からとられた色名は、まず見当たらない。,#FFA594,やわらかい黄みの赤
ブロンド,2Y 7.5/7,11世紀頃のフランス語の色名に由来するが、起源は古ゲルマン語で、 単に明るい色という意味だったようである。それが主に金髪を表す特殊な色名になった。英語の色名としても15世紀には使われていたようである。,#E3B466,やわらかい黄